{
  "t": "attestation",
  "kind": "app_attest",
  "token": "eyJrZXlfaWQiOiJkbVZqZEc5eWN5MWhjSEF0WVhSMFpYTjBMV3RsZVMxcFpDMHdNREF3TURFPSIsImFzc2VydGlvbiI6ImJtOTBJR0VnY21WaGJDQkJjSEFnUVhSMFpYTjBJR0Z6YzJWeWRHbHZiZyIsImNsaWVudF9kYXRhX2hhc2giOiIwMzYwMjc4Yzg5ZDNlZTg2MTc5ZjM0MTI0OTYwMDQ5YjFkMGZjNGY5MDljYTAyYzY4MGU1ODAxZDI5YWFjZTFjIn0",
  "request_hash": "0360278c89d3ee86179f34124960049b1d0fc4f909ca02c680e5801d29aace1c"
}
